{
    "@id": "http://schema.org/PersonAvailability",
    "name": "PersonAvailability",
    "title": "PersonAvailability",
    "abstract": false,
    "sealed": false,
    "version": "1.0",
    "fields": [
        {
            "@id": "https://themost.io/schemas/id",
            "name": "id",
            "title": "id",
            "description": "The identifier of the item.",
            "type": "Counter",
            "primary": true
        },
        {
            "@id": "http://schema.org/contributor",
            "name": "person",
            "title": "person",
            "type": "Person"
        },
        {
            "@id": "http://schema.org/eventHoursSpecification",
            "name": "eventHoursSpecification",
            "title": "eventHoursSpecification",
            "description": "Event Hours Specification.",
            "type": "EventHoursSpecification"
        },
        {
            "@id": "https://themost.io/schemas/conditional",
            "name": "conditional",
            "title": "Conditional",
            "type": "Boolean",
            "nullable": false,
            "value": "javascript:return false;"
        }
    ],
    "privileges": [
        {
            "mask": 1,
            "type": "global",
            "account": "*"
        },
        {
            "mask": 15,
            "type": "global"
        },
        {
            "mask": 15,
            "type": "global",
            "account": "Administrators"
        }
    ]
}